{
  "$schema": "https://json-schema.org/draft/2020-12/schema",
  "$id": "urn:agent-platform:event-type-definition:v1",
  "title": "EventTypeDefinition",
  "type": "object",
  "required": [
    "type",
    "data_version",
    "data_schema",
    "classification",
    "retention_class",
    "contains_user_content"
  ],
  "properties": {
    "type": {
      "type": "string",
      "pattern": "^[a-z][a-z0-9_.-]{2,191}$"
    },
    "data_version": {
      "type": "integer",
      "minimum": 1
    },
    "data_schema": {
      "type": "object",
      "required": [
        "uri",
        "digest",
        "dialect",
        "digest_profile"
      ],
      "properties": {
        "uri": {
          "type": "string",
          "format": "uri"
        },
        "digest": {
          "type": "string",
          "pattern": "^sha256:[0-9a-f]{64}$"
        },
        "dialect": {
          "const": "https://json-schema.org/draft/2020-12/schema"
        },
        "digest_profile": {
          "const": "rfc8785-schema-closure-v1",
          "description": "JCS SHA-256 over {root, dependencies}, where dependencies are the transitive external schemas sorted by absolute $id."
        }
      },
      "additionalProperties": false
    },
    "classification": {
      "enum": [
        "public",
        "internal",
        "confidential",
        "restricted"
      ]
    },
    "retention_class": {
      "enum": [
        "operational",
        "audit",
        "ephemeral"
      ]
    },
    "contains_user_content": {
      "type": "boolean"
    },
    "projection_consumers": {
      "type": "array",
      "uniqueItems": true,
      "items": {
        "type": "string"
      }
    }
  },
  "additionalProperties": false
}
