{
  "type": "artifact.version.created",
  "data_version": 1,
  "data_schema": {
    "uri": "urn:agent-platform:platform-core-event-data:v1#/$defs/artifactVersionCreated",
    "digest": "sha256:f299ab06170d756ea41f4ccc4e5cfe8b01d6ee648d4ddb7dab5bca2cbd9f6bc0",
    "dialect": "https://json-schema.org/draft/2020-12/schema",
    "digest_profile": "rfc8785-schema-closure-v1"
  },
  "classification": "internal",
  "retention_class": "operational",
  "contains_user_content": false,
  "projection_consumers": [
    "artifact-projection",
    "timeline-projection"
  ]
}
